WhatsApp Image 2026-04-07 at 10.40.50.jpeg	terrace-dining-sunset	Outdoor dining table at sunset with pastel sky
WhatsApp Image 2026-04-07 at 10.40.51.jpeg	terrace-sunset-panorama	Terrace at sunset with daybed, pergola, and sea view
WhatsApp Image 2026-04-07 at 10.40.51 (1).jpeg	terrace-daybed-sunset	Terrace daybed and dining area at golden hour
WhatsApp Image 2026-04-07 at 10.40.51 (2).jpeg	daybed-moon-sunset	Daybed at sunset with rising moon over the bay
WhatsApp Image 2026-04-07 at 10.40.51 (3).jpeg	living-room-sliding-doors	Living room sliding doors opening to the sea view terrace
WhatsApp Image 2026-04-07 at 10.40.51 (4).jpeg	terrace-dining-day	Covered terrace dining area with midday harbor view
WhatsApp Image 2026-04-07 at 10.40.51 (5).jpeg	daybed-tree-sunset	Daybed beside olive tree with harbor sunset view
